<?xml version="1.0" encoding="UTF-8"?>

<etapa 
    xmlns="http://www.uniovi.es"
    xmlns:xsi="http://www.w3.org/2001/XMLSchema-instance"
    xsi:schemaLocation="http://www.uniovi.es etapa.xsd">

    <nombre>Alcaraz a Elche de la Sierra</nombre>

    <numero>10</numero>
    
    <longitud unidad="km">184.7</longitud>
    
    <fecha>2026-09-01</fecha>
    
    <tiempoGanador>PT4H7M41S</tiempoGanador>
    
    <velocidadMedia unidad="km/h">44.74</velocidadMedia>
    
    <desnivel unidad="m">2991</desnivel>
    
    <salida>
        <lugar>Alcaraz</lugar>
        <coordenadas>
            <longitudGeografica unidad="grados">-2.4926058</longitudGeografica>
            <latitudGeografica unidad="grados">38.6701929</latitudGeografica>
            <altitud unidad="m">839</altitud>
        </coordenadas>
    </salida>

    <meta>
        <lugar>Elche de la Sierra</lugar>
        <coordenadas>
            <longitudGeografica unidad="grados">-2.0495278</longitudGeografica>
            <latitudGeografica unidad="grados">38.4521389</latitudGeografica>
            <altitud unidad="m">644</altitud>
        </coordenadas>
    </meta>
    
    <tipo>Ondulada</tipo>
    
    <referencias>
        <referencia>https://www.lavuelta.es/es/etapa-10</referencia>
        <referencia>https://alcaraz.es/</referencia>
        <referencia>https://elchedelasierra.es/</referencia>
    </referencias>
    
    <galeriaFotos>
        <fotografia>../multimedia/alcaraz.jpg</fotografia>
        <fotografia>../multimedia/elche-de-la-sierra.jpg</fotografia>
    </galeriaFotos>

    <galeriaVideos>
        <video>../multimedia/final-etapa.mp4</video>
    </galeriaVideos>

    <galeriaSonidos>
        <sonido>../multimedia/final-etapa.mp3</sonido>
    </galeriaSonidos>

    <hitos>
        <puerto categoria="tercera">
            <nombreHito>Puerto del Peralejo</nombreHito>
            <coordenadas>
                <longitudGeografica unidad="grados">-2.3059682</longitudGeografica>
                <latitudGeografica unidad="grados">38.4926808</latitudGeografica>
                <altitud unidad="m">1132</altitud>
            </coordenadas>
            <distancia unidad="km">47.6</distancia>
        </puerto>

        <puerto categoria="tercera">
            <nombreHito>Puerto de Aýna</nombreHito>
            <coordenadas>
                <longitudGeografica unidad="grados">-2.0373940</longitudGeografica>
                <latitudGeografica unidad="grados">38.5805260</latitudGeografica>
                <altitud unidad="m">950</altitud>
            </coordenadas>
            <distancia unidad="km">86.3</distancia>
        </puerto>

        <sprint tipo="intermedio">
            <nombreHito>Hellín</nombreHito>
            <coordenadas>
                <longitudGeografica unidad="grados">-1.7020840</longitudGeografica>
                <latitudGeografica unidad="grados">38.5087420</latitudGeografica>
                <altitud unidad="m">546</altitud>
            </coordenadas>
            <distancia unidad="km">125.0</distancia>
        </sprint>

        <sprint tipo="bonificado">
            <nombreHito>Hellín</nombreHito>
            <coordenadas>
                <longitudGeografica unidad="grados">-1.7020840</longitudGeografica>
                <latitudGeografica unidad="grados">38.5087420</latitudGeografica>
                <altitud unidad="m">546</altitud>
            </coordenadas>
            <distancia unidad="km">125.0</distancia>
        </sprint>

        <puerto categoria="tercera">
            <nombreHito>Puerto de Socovos</nombreHito>
            <coordenadas>
                <longitudGeografica unidad="grados">-1.9896330</longitudGeografica>
                <latitudGeografica unidad="grados">38.3380090</latitudGeografica>
                <altitud unidad="m">782</altitud>
            </coordenadas>
            <distancia unidad="km">163.3</distancia>
        </puerto>
    </hitos>

    <trazado>

        <punto>
            <nombrePunto>Alcaraz (Salida)</nombrePunto>
            <coordenadas>
                <longitudGeografica unidad="grados">-2.4926058</longitudGeografica>
                <latitudGeografica unidad="grados">38.6701929</latitudGeografica>
                <altitud unidad="m">839</altitud>
            </coordenadas>
            <distancia unidad="km">0</distancia>
        </punto>

        <punto>
            <coordenadas>
                <longitudGeografica unidad="grados">-2.5662550</longitudGeografica>
                <latitudGeografica unidad="grados">38.6445256</latitudGeografica>
                <altitud unidad="m">815</altitud>
            </coordenadas>
            <distancia unidad="km">8.0</distancia>
        </punto>

        <punto>
            <coordenadas>
                <longitudGeografica unidad="grados">-2.5617965</longitudGeografica>
                <latitudGeografica unidad="grados">38.5997948</latitudGeografica>
                <altitud unidad="m">895</altitud>
            </coordenadas>
            <distancia unidad="km">13.6</distancia>
        </punto>

        <punto>
            <coordenadas>
                <longitudGeografica unidad="grados">-2.5023923</longitudGeografica>
                <latitudGeografica unidad="grados">38.5568621</latitudGeografica>
                <altitud unidad="m">1085</altitud>
            </coordenadas>
            <distancia unidad="km">21.8</distancia>
        </punto>

        <punto>
            <coordenadas>
                <longitudGeografica unidad="grados">-2.5097056</longitudGeografica>
                <latitudGeografica unidad="grados">38.5152807</latitudGeografica>
                <altitud unidad="m">1251</altitud>
            </coordenadas>
            <distancia unidad="km">27.0</distancia>
        </punto>

        <punto>
            <coordenadas>
                <longitudGeografica unidad="grados">-2.3985286</longitudGeografica>
                <latitudGeografica unidad="grados">38.4890987</latitudGeografica>
                <altitud unidad="m">931</altitud>
            </coordenadas>
            <distancia unidad="km">38.3</distancia>
        </punto>

        <punto>
            <nombrePunto>Puerto del Peralejo</nombrePunto>
            <coordenadas>
                <longitudGeografica unidad="grados">-2.3059682</longitudGeografica>
                <latitudGeografica unidad="grados">38.4926808</latitudGeografica>
                <altitud unidad="m">1132</altitud>
            </coordenadas>
            <distancia unidad="km">47.6</distancia>
        </punto>

        <punto>
            <coordenadas>
                <longitudGeografica unidad="grados">-2.2202702</longitudGeografica>
                <latitudGeografica unidad="grados">38.4835433</latitudGeografica>
                <altitud unidad="m">974</altitud>
            </coordenadas>
            <distancia unidad="km">56.9</distancia>
        </punto>

        <punto>
            <coordenadas>
                <longitudGeografica unidad="grados">-2.1865278</longitudGeografica>
                <latitudGeografica unidad="grados">38.5212241</latitudGeografica>
                <altitud unidad="m">1128</altitud>
            </coordenadas>
            <distancia unidad="km">63.4</distancia>
        </punto>

        <punto>
            <coordenadas>
                <longitudGeografica unidad="grados">-2.1312977</longitudGeografica>
                <latitudGeografica unidad="grados">38.5216610</latitudGeografica>
                <altitud unidad="m">995</altitud>
            </coordenadas>
            <distancia unidad="km">69.5</distancia>
        </punto>

        <punto>
            <coordenadas>
                <longitudGeografica unidad="grados">-2.1043319</longitudGeografica>
                <latitudGeografica unidad="grados">38.5376988</latitudGeografica>
                <altitud unidad="m">977</altitud>
            </coordenadas>
            <distancia unidad="km">73.1</distancia>
        </punto>

        <punto>
            <coordenadas>
                <longitudGeografica unidad="grados">-2.1215547</longitudGeografica>
                <latitudGeografica unidad="grados">38.5456351</latitudGeografica>
                <altitud unidad="m">802</altitud>
            </coordenadas>
            <distancia unidad="km">75.2</distancia>
        </punto>

        <punto>
            <coordenadas>
                <longitudGeografica unidad="grados">-2.0697780</longitudGeografica>
                <latitudGeografica unidad="grados">38.5534712</latitudGeografica>
                <altitud unidad="m">763</altitud>
            </coordenadas>
            <distancia unidad="km">80.8</distancia>
        </punto>

        <punto>
            <nombrePunto>Puerto de Aýna</nombrePunto>
            <coordenadas>
                <longitudGeografica unidad="grados">-2.0373940</longitudGeografica>
                <latitudGeografica unidad="grados">38.5805260</latitudGeografica>
                <altitud unidad="m">950</altitud>
            </coordenadas>
            <distancia unidad="km">86.3</distancia>
        </punto>

        <punto>
            <coordenadas>
                <longitudGeografica unidad="grados">-2.0268454</longitudGeografica>
                <latitudGeografica unidad="grados">38.5945657</latitudGeografica>
                <altitud unidad="m">909</altitud>
            </coordenadas>
            <distancia unidad="km">88.2</distancia>
        </punto>

        <punto>
            <coordenadas>
                <longitudGeografica unidad="grados">-1.9455826</longitudGeografica>
                <latitudGeografica unidad="grados">38.5528902</latitudGeografica>
                <altitud unidad="m">757</altitud>
            </coordenadas>
            <distancia unidad="km">97.6</distancia>
        </punto>

        <punto>
            <coordenadas>
                <longitudGeografica unidad="grados">-1.8027205</longitudGeografica>
                <latitudGeografica unidad="grados">38.5269217</latitudGeografica>